{"$schema":"https://json-schema.org/draft/2020-12/schema","title":"P0DecisionFamilyRegistry","type":"object","additionalProperties":false,"required":["registry_id","version","status","target_scope","families","not_in_scope"],"properties":{"registry_id":{"type":"string"},"version":{"type":"string"},"status":{"type":"string"},"target_scope":{"type":"object"},"families":{"type":"array","minItems":10,"items":{"type":"object","required":["id","purpose","allowed_scope","owner_role","downstream_consumer","required_evidence_types","forbidden_overclaims"],"properties":{"id":{"enum":["v4_element_identity","layout_structure","media_choice","text_semantics","interaction_link_topology","positioning_safety","styling_mechanism","class_scope","value_binding","unit_decision"]},"purpose":{"type":"string"},"allowed_scope":{"type":"string"},"owner_role":{"type":"string"},"downstream_consumer":{"type":"array"},"required_evidence_types":{"type":"array"},"forbidden_overclaims":{"type":"array"}}}},"not_in_scope":{"type":"array"}}}
