{"registry_id":"p0-decision-family-registry.v0","version":"0.1.0","status":"foundation","target_scope":{"valid_target_options":["elementor_v4"],"forbidden_valid_target_options":["elementor_v3"]},"families":[{"id":"v4_element_identity","purpose":"Choose and preserve V4 atomic element identity before Builder action.","allowed_scope":"Kernel-local P0 governance family only.","owner_role":"Kernel","downstream_consumer":["Architect","CE","Builder"],"required_evidence_types":["official_documented_capability","target_project_export_observed","v4_only_target_scope"],"forbidden_overclaims":["project_availability_proven_by_official_docs","constructability_proven_by_docs","builder_execution_proven","frontend_runtime_validated","production_ready","v3_valid_target_option"]},{"id":"layout_structure","purpose":"Govern structural layout choices such as Div Block, Flexbox, and Grid.","allowed_scope":"Kernel-local P0 governance family only.","owner_role":"Kernel","downstream_consumer":["Architect","CE","Builder"],"required_evidence_types":["content_structure_intent","child_topology","official_documented_capability","target_project_export_observed"],"forbidden_overclaims":["project_availability_proven_by_official_docs","constructability_proven_by_docs","builder_execution_proven","frontend_runtime_validated","production_ready","v3_valid_target_option"]},{"id":"media_choice","purpose":"Govern Image versus SVG and media asset choices.","allowed_scope":"Kernel-local P0 governance family only.","owner_role":"Kernel","downstream_consumer":["Architect","CE","Builder"],"required_evidence_types":["asset_type","asset_provenance","decorative_or_meaningful_role","accessibility_treatment"],"forbidden_overclaims":["project_availability_proven_by_official_docs","constructability_proven_by_docs","builder_execution_proven","frontend_runtime_validated","production_ready","v3_valid_target_option"]},{"id":"text_semantics","purpose":"Govern Heading versus Paragraph semantic text choices.","allowed_scope":"Kernel-local P0 governance family only.","owner_role":"Kernel","downstream_consumer":["Architect","CE","Builder"],"required_evidence_types":["content_role","document_outline_intent","editable_text_requirement","accessibility_treatment"],"forbidden_overclaims":["project_availability_proven_by_official_docs","constructability_proven_by_docs","builder_execution_proven","frontend_runtime_validated","production_ready","v3_valid_target_option"]},{"id":"interaction_link_topology","purpose":"Govern clickable and link topology decisions.","allowed_scope":"Kernel-local P0 governance family only.","owner_role":"Kernel","downstream_consumer":["Architect","CE","Builder"],"required_evidence_types":["click_target_map","ancestor_descendant_topology","interaction_intent","nested_clickable_check"],"forbidden_overclaims":["project_availability_proven_by_official_docs","constructability_proven_by_docs","builder_execution_proven","frontend_runtime_validated","production_ready","v3_valid_target_option"]},{"id":"positioning_safety","purpose":"Govern normal-flow, relative, and absolute positioning safety.","allowed_scope":"Kernel-local P0 governance family only.","owner_role":"Kernel","downstream_consumer":["Architect","CE","Builder"],"required_evidence_types":["normal_flow_impact","containing_block_evidence","overlay_scope","responsive_risk_note"],"forbidden_overclaims":["project_availability_proven_by_official_docs","constructability_proven_by_docs","builder_execution_proven","frontend_runtime_validated","production_ready","v3_valid_target_option"]},{"id":"styling_mechanism","purpose":"Govern native control, class, variable, literal, and Custom CSS mechanism choices.","allowed_scope":"Kernel-local P0 governance family only.","owner_role":"Kernel","downstream_consumer":["Architect","CE","Builder"],"required_evidence_types":["native_control_availability","class_or_variable_availability","custom_css_environment_boundary","project_availability_evidence"],"forbidden_overclaims":["project_availability_proven_by_official_docs","constructability_proven_by_docs","builder_execution_proven","frontend_runtime_validated","production_ready","v3_valid_target_option"]},{"id":"class_scope","purpose":"Govern local class, global class, and local property scope decisions.","allowed_scope":"Kernel-local P0 governance family only.","owner_role":"Kernel","downstream_consumer":["Architect","CE","Builder"],"required_evidence_types":["class_registry_evidence","class_order_evidence","local_override_evidence","project_export_observed"],"forbidden_overclaims":["project_availability_proven_by_official_docs","constructability_proven_by_docs","builder_execution_proven","frontend_runtime_validated","production_ready","v3_valid_target_option"]},{"id":"value_binding","purpose":"Govern static literal, variable, dynamic data, and resolved-value binding choices.","allowed_scope":"Kernel-local P0 governance family only.","owner_role":"Kernel","downstream_consumer":["Architect","CE","Builder"],"required_evidence_types":["binding_source_type","variable_or_dynamic_data_registry_evidence","fallback_behavior","project_availability_evidence"],"forbidden_overclaims":["project_availability_proven_by_official_docs","constructability_proven_by_docs","builder_execution_proven","frontend_runtime_validated","production_ready","v3_valid_target_option"]},{"id":"unit_decision","purpose":"Govern px/rem/%/auto/variable/unit choices without formula evaluation.","allowed_scope":"Kernel-local P0 governance family only.","owner_role":"Kernel","downstream_consumer":["Architect","CE","Builder"],"required_evidence_types":["unit_context","conversion_context","responsive_variant_context","formula_registry_context"],"forbidden_overclaims":["project_availability_proven_by_official_docs","constructability_proven_by_docs","builder_execution_proven","frontend_runtime_validated","production_ready","v3_valid_target_option"]}],"not_in_scope":["full_decision_matrix","full_elementor_feature_registry","full_control_level_registry"]}
